file_name,libristutter_whisper,librispeech_gt,wer_libristutter_whisper
198-209-0000,mrs allen said chathryn the next morning will there be any harm in my calling on miss tilney today i shall not be easy till i have explained everything go by all means my dear only put on a white gown miss tilney always wears white,missus allen said catherine the next morning will there be any harm in my calling on miss tilney today i shall not be easy till i have explained everything go by all means my dear only put on a white gown miss tilney always wears white,0.043478260869565216
198-209-0001,catherine cheerfully complied and being properly equipped was more impatient than ever to be at the pump room that she might inform herself of general tilnese lodgings for those she believed they were in milson street she was not certain of the house,catherine cheerfully complied and being properly equipped was more impatient than ever to be at the pump room that she might inform herself of general tilneys lodgings for though she believed they were in milsom street she was not certain of the house,0.06976744186046512
198-209-0002,and mrs allens wavering convictions only made it more doubtful to milsom street she was directed and having made herself perfect in the number hastened away with eager steps and a beating heart to pay her visit explain her conduct and be forgiven,and missus allens wavering convictions only made it more doubtful to milsom street she was directed and having made herself perfect in the number hastened away with eager steps and a beating heart to pay her visit explain her conduct and be forgiven,0.023255813953488372
198-209-0003,tripping lightly through the church yard and resolutely turning away her eyes that she might not be obliged to see her beloved isabella and her dear family who she had reason to believe win a shop hard by she reached the house without any impediment looked at the number,tripping lightly through the church yard and resolutely turning away her eyes that she might not be obliged to see her beloved isabella and her dear family who she had reason to believe were in a shop hard by she reached the house without any impediment looked at the number,0.04081632653061224
198-209-0004,and with a look which did not quite confirm his words said that he had been mistaken for that miss tilney was walked out catherine with a blush of mortification left the house she felt almost persuaded that miss tilney was at home and too much offended to admit her,and with a look which did not quite confirm his words said he had been mistaken for that miss tilney was walked out catherine with a blush of mortification left the house she felt almost persuaded that miss tilney was at home and too much offended to admit her,0.02
198-209-0005,and as she retired down the street could not withhold one glance at the trying room windows an expectation of seeing her there,and as she retired down the street could not withhold one glance at the drawing room windows in expectation of seeing her there,0.08695652173913043
198-209-0006,at the bottom of the street however she looked back again and then not at a window but issuing from the door she saw miss tildi herself she was followed by a gentleman whom catherine believed to be her father and they turned up towards edgars buildings,at the bottom of the street however she looked back again and then not at a window but issuing from the door she saw miss tilney herself she was followed by a gentleman whom catherine believed to be her father and they turned up towards edgars buildings,0.02127659574468085
198-209-0007,catherine in deep mortification proceeded on her way she could almost be angry herself at such angry insuffility but she checked the resentful sensation she remembered her own ignorance she knew not how such an offense as hers might be classed by the laws of worldly politeness,catherine in deep mortification proceeded on her way she could almost be angry herself at such angry incivility but she checked the resentful sensation she remembered her own ignorance she knew not how such an offence as hers might be classed by the laws of worldly politeness,0.0425531914893617
198-209-0008,to what a degree of unforgiveness it might with propriety leave nor to what rigors of ruinous in redotrain it might justly make her amenable dejected and humbled she had even some thoughts of not going with the others to the theatre that night,to what a degree of unforgivingness it might with propriety lead nor to what rigours of rudeness in return it might justly make her amenable dejected and humbled she had even some thoughts of not going with the others to the theatre that night,0.11363636363636363
198-209-0009,for she soon recollected in the first place that she was without any excuse for staying at home and in the second,for she soon recollected in the first place that she was without any excuse for staying at home and in the second,0.0
198-209-0010,to the theater accordingly they all went notil lees appeared to plague or please her she feared that amongst the many perfections of the family a fondness for plays was not to be ranked but perhaps it was because they were habituated to the finer performances of the london stage,to the theatre accordingly they all went no tilneys appeared to plague or please her she feared that amongst the many perfections of the family a fondness for plays was not to be ranked but perhaps it was because they were habituated to the finer performances of the london stage,0.06
198-209-0011,on the beginning of the 5th however the sudden view of mr henry tilney and his father joining a party in the opposite box recalled her to anxiety and distress the stage could no longer excite genuine merriment no longer keep her whole attention,on the beginning of the fifth however the sudden view of mister henry tilney and his father joining a party in the opposite box recalled her to anxiety and distress the stage could no longer excite genuine merriment no longer keep her whole attention,0.045454545454545456
198-209-0012,every other look upon an average was directed towards the opposite box and for the space of two entire scenes did she thus watch henry tillney without being once able to catch his eye no longer could he be suspected of indifference for a play,every other look upon an average was directed towards the opposite box and for the space of two entire scenes did she thus watch henry tilney without being once able to catch his eye no longer could he be suspected of indifference for a play,0.022222222222222223
198-209-0013,his notice was never withdrawn from the stage during two whole scenes,his notice was never withdrawn from the stage during two whole scenes,0.0
198-209-0014,and forced him to hear her explanation feelings rather natural than heroic possess her instead of considering her own dignity injured by this readycondemnation instead of proudly resolving incontious innocence,and forced him to hear her explanation feelings rather natural than heroic possessed her instead of considering her own dignity injured by this ready condemnation instead of proudly resolving in conscious innocence,0.16666666666666666
198-209-0015,to show her resentment towards him who could harbor a doubt of it to leave to him all the trouble of seeking to keep picking an explanation and to enlighten him on the past only by avoiding his sight or flirting with somebody else she took to herself all the shame of misconduct,to show her resentment towards him who could harbour a doubt of it to leave to him all the trouble of seeking an explanation and to enlighten him on the past only by avoiding his sight or flirting with somebody else she took to herself all the shame of misconduct,0.07547169811320754
198-209-0016,or at least of its appearance and was only eager for an opportunity of explaining its cause the play concluded the curtain fell henry tilney was no longer to be seen where he had hitherto sat but his father remained,or at least of its appearance and was only eager for an opportunity of explaining its cause the play concluded the curtain fell henry tilney was no longer to be seen where he had hitherto sat but his father remained,0.0
198-209-0017,and perhaps he might be now coming round to their box she was right in a few minutes he appeared,and perhaps he might be now coming round to their box she was right in a few minutes he appeared,0.0
198-209-0018,you must have thought me so rude but indeed it was not my own fault was it mrs allen did not they tell me that mr tilney and his sister were gone out in a fayetin together and then what could i do but i had ten thousand times rather have been with you,you must have thought me so rude but indeed it was not my own fault was it missus allen did not they tell me that mister tilney and his sister were gone out in a phaeton together and then what could i do but i had ten thousand times rather have been with you,0.05555555555555555
198-209-0019,my dear you tumble my my my gown with mrs allens reply her assurance however standing soul assurance however standing soul as it did was not thrown away it brought a more cordial more natural smile into his countenance,my dear you tumble my gown was missus allens reply her assurance however standing sole as it did was not thrown away it brought a more cordial more natural smile into his countenance,0.23076923076923078
198-209-0020,and he replied in a tone which were chained only a little effect of reserve who are you who are you who have much obliged to you at any rate for wishing us a pleasant walk after our passing you in argyles street you were so kind as to look back on purpose,and he replied in a tone which retained only a little affected reserve we were much obliged to you at any rate for wishing us a pleasant walk after our passing you in argyle street you were so kind as to look back on purpose,0.24528301886792453
198-209-0021,but indeed i did not wish you a pleasant walk i never thought of such a thing but i begged mr thorpe so earnestly to stop i called out to him as soon as ever i saw you now mrs allen did not—oh you were not there—but indeed i did and if mr thorpe would only have stopped i would have been there,but indeed i did not wish you a pleasant walk i never thought of such a thing but i begged mister thorpe so earnestly to stop i called out to him as soon as ever i saw you now missus allen did not oh you were not there but indeed i did and if mister thorpe would only have stopped,0.19047619047619047
198-209-0022,i would have jumped out and run after you is there a henry in the world the world i would be insensible to such a declaration henry till me at least was not with the yetsweeters i was sweetest sweetest mile he said everything that need to be said of his sisters concern regret,i would have jumped out and run after you is there a henry in the world who could be insensible to such a declaration henry tilney at least was not with a yet sweeter smile he said everything that need be said of his sisters concern regret,0.25925925925925924
198-209-0023,and dependence on catherines honor oh do not say miss—that say miss—at say miss tilney was not angry cried catherine because i know she was for she would not see me this morning when i called called i saw her walk out of the house the next minute after by leaving it i was hurt but i was not confronted,and dependence on catherines honour oh do not say miss tilney was not angry cried catherine because i know she was for she would not see me this morning when i called i saw her walk out of the house the next minute after my leaving it i was hurt but i was not affronted,0.13333333333333333
198-209-0024,perhaps you did not know i had been there i was not within at the time but i heard of it from eleanor and she has been wishing ever since to see you to explain the reason of such instability but perhaps i can do it as well it was nothing more than that my father—,perhaps you did not know i had been there i was not within at the time but i heard of it from eleanor and she has been wishing ever since to see you to explain the reason of such incivility but perhaps i can do it as well it was nothing more than that my father,0.03571428571428571
198-209-0025,and he being hurried for time and at time and not caring to have it put off made a point of her being denied that was all i do assure you,and he being hurried for time and not caring to have it put off made a point of her being denied that was all i do assure you,0.0967741935483871
198-209-0026,and meant to make her apology as soon as possible catherines mind was greatly eased by this information yet as something a solicitude remained from which sprang the following question thoroughly artless in itself though rather distressing to the gentleman but mr tilney,and meant to make her apology as soon as possible catherines mind was greatly eased by this information yet a something of solicitude remained from which sprang the following question thoroughly artless in itself though rather distressing to the gentleman but mister tilney,0.06976744186046512
198-209-0027,why were you less generous than your sister if she felt such confidence in my good intentions and could suppose it to be what would be only a mistake why should you be so ready to take offense me id take offense,why were you less generous than your sister if she felt such confidence in my good intentions and could suppose it to be only a mistake why should you be so ready to take offence me i take offence,0.14285714285714285
198-209-0028,nay im sure by you—sure by you look—when you came into the box you were angry i angry i could have no right well no right well nobody would have thought you had no right to saw your face he replied by asking her to make room for him and talking of the play he remained with them some time,nay i am sure by your look when you came into the box you were angry i angry i could have no right well nobody would have thought you had no right who saw your face he replied by asking her to make room for him and talking of the play he remained with them some time,0.16666666666666666
198-209-0029,and was only too agreeable for catherine to be contented when he went away before they parted however he was a greaer he was a greaer and verer he was a greaed that the projected walk should be taken as soon as possible and was possible and setting aside the misery of his quitting their box,and was only too agreeable for catherine to be contented when he went away before they parted however it was agreed that the projected walk should be taken as soon as possible and setting aside the misery of his quitting their box,0.2857142857142857
198-209-0030,she was upon the whole left one of the happiest creatures in the world while talking to each other,she was upon the whole left one of the happiest creatures in the world while talking to each other,0.0
198-209-0031,was engaged in conversation with general tilney,was engaged in conversation with general tilney,0.0
198-209-0032,what could they have to say of her she failed general tilly did not like her appearance she found it was implied in his preventing her admittance to his daughter rather than postpone his own walk a few minutes how came mr thorpe to know your father was her anxious inquiry,what could they have to say of her she feared general tilney did not like her appearance she found it was implied in his preventing her admittance to his daughter rather than postpone his own walk a few minutes how came mister thorpe to know your father was her anxious inquiry,0.058823529411764705
198-209-0033,as she pointed them out to her asham asham asham andpanion he knew nothing about it but his father like every military man,as she pointed them out to her companion he knew nothing about it but his father like every military man,0.17391304347826086
198-209-0034,when the entertainment was over thorpe came to assist them in getting out catherine was the immediate object of his gallantry with the object of his gallantry and while they waited in the lobby for a chair he prevented the inquiry which had travelled from her heart almost to the tip of her tongue by asking,when the entertainment was over thorpe came to assist them in getting out catherine was the immediate object of his gallantry and while they waited in the lobby for a chair he prevented the inquiry which had travelled from her heart almost to the tip of her tongue by asking,0.10714285714285714
198-209-0035,in a consequential manner whether she had seen him talking with with general tell me hes a witty hes a witty hes a final fellow upon my soul stout active looks as young as his son i have a great regard for him i assure you,in a consequential manner whether she had seen him talking with general tilney he is a fine old fellow upon my soul stout active looks as young as his son i have a great regard for him i assure you,0.2391304347826087
198-209-0036,no him him there are a few people much about town that i do not know i have met him forever at the bedford and i knew his face again today the moment he came into the billiardroom one of the finest players we have by the by and we had a little touch together though i was almost afraid of him at first,know him there are few people much about town that i do not know i have met him forever at the bedford and i knew his face again today the moment he came into the billiard room one of the best players we have by the by and we had a little touch together though i was almost afraid of him at first,0.09375
198-209-0037,the odds were five to four against me and if i had not made one of the cleanest jokes that perhaps whatever was made in this world i took his ball exactly but i could not make you understand it without a table however i did beat him a very fine fellow as riches had chewed,the odds were five to four against me and if i had not made one of the cleanest strokes that perhaps ever was made in this world i took his ball exactly but i could not make you understand it without a table however i did beat him a very fine fellow as rich as a jew,0.10714285714285714
198-209-0038,lowering his voice well well well well well done general said i am quite of your mind,lowering his voice well done general said i i am quite of your mind,0.29411764705882354
198-126831-0000,friday was a comfortable day in the household of king everybody was in a good humor the story girls sparkled through several tales that ranged from the affrites and gins of eastern myth through the piping days of shivalry down to the homely anecdotes of carlisle rokdae folks,friday was a comfortable day in the household of king everybody was in good humour the story girl sparkled through several tales that ranged from the afrites and jinns of eastern myth through the piping days of chivalry down to the homely anecdotes of carlisle workaday folks,0.14583333333333334
198-126831-0001,she was in turn an oriental princess behind a silk envelope the bride who followed her bridegroom to the wars of palestine disguised as a page gallant lady who ransomed her diamond necklace by dancing a cronto,she was in turn an oriental princess behind a silken veil the bride who followed her bridegroom to the wars of palestine disguised as a page the gallant lady who ransomed her diamond necklace by dancing a coranto,0.10810810810810811
198-126831-0002,with the highway man on a moonlit heath and buscooks girl who joined the sons and daughters of temperance just to see what was into it and in each impersonation she was so thoroughly the thing impersonated,with a highwayman on a moonlit heath and buskirks girl who joined the sons and daughters of temperance just to see what was into it and in each impersonation she was so thoroughly the thing impersonated,0.10810810810810811
198-126831-0003,sessily and sarah ray found a sweet new knitted lace pattern in an old magazine,cecily and sara ray found a sweet new knitted lace pattern in an old magazine,0.13333333333333333
198-126831-0004,chancing accidentally i vowed over here certain of these secrets i learned that sarah ray had named an ample for johnny price and cessli truth you live there was eight seeds in it and you know eight means they both love,chancing accidentally i vow to overhear certain of these secrets i learned that sara ray had named an apple for johnny price and cecily trues you live there was eight seeds in it and you know eight means they both love,0.17073170731707318
198-126831-0005,while sicily admitted that willie fraser had written on his slate and showed it to her you love me as i love you no knife can cut our love into into but sarah ray never you breathe this to a living soul,while cecily admitted that willy fraser had written on his slate and showed it to her if you love me as i love you no knife can cut our love in two but sara ray never you breathe this to a living soul,0.14285714285714285
198-126831-0006,cessely how old must we be before we can have a real bow but sarah always denied it so im inclined to believe felix simply made it up himself patty distinguished himself by catching a rat,cecily how old must we be before we can have a real beau but sara always denied it so i am inclined to believe felix simply made it up himself paddy distinguished himself by catching a rat,0.16666666666666666
198-126831-0007,and being intolerably conceited about it until sarah rae cured and rae cured rae cured him by calling him a dear sweet cat and kissing him between the ears then pat sneaked objectively off his tail and off his tail drooping,and being intolerably conceited about it until sara ray cured him by calling him a dear sweet cat and kissing him between the ears then pat sneaked abjectly off his tail drooping,0.2926829268292683
198-126831-0008,very few cats have and most of them have such an inordinate appetite for pottery that they will swallow any amount of it and thrive thereon patty had a finer taste the story girl and i were the only ones who could pay him compliments to his liking,very few cats have and most of them have such an inordinate appetite for flattery that they will swallow any amount of it and thrive thereon paddy had a finer taste the story girl and i were the only ones who could pay him compliments to his liking,0.041666666666666664
198-126831-0009,the storygirl would box his ears with her fist and say bless your grey heart patty youre a good sort of old rascal good sort of old rascal good sort of old rascal and pat would purr his satisfaction i used to take a handful of skin on his back shake him gently and say,the story girl would box his ears with her fist and say bless your gray heart paddy youre a good sort of old rascal and pat would purr his satisfaction i used to take a handful of the skin on his back shake him gently and say,0.2727272727272727
198-126831-0010,pat youve forgotten more than any human being ever knew and i vow patty would lick his chops with the light but to be called a sweet cat oh sarah sarah,pat youve forgotten more than any human being ever knew and i vow paddy would lick his chops with delight but to be called a sweet cat oh sara sara,0.16129032258064516
198-126831-0011,focity tried and had the most gratifying luck with a new and complicated cake recipe a gorgeous compound,felicity tried and had the most gratifying luck with a new and complicated cake recipe a gorgeous compound,0.05555555555555555
198-126831-0012,the number of eggs she used in it would have shocked and jannits and its then its thrifty soul but that cake like beauty was its own excuse uncle roger ate three slices of it at tea time and told felicity she was an artist,the number of eggs she used in it would have shocked aunt janets thrifty soul but that cake like beauty was its own excuse uncle roger ate three slices of it at tea time and told felicity she was an artist,0.13333333333333333
198-126831-0013,the poor man meant as a compliment but felicity who knew uncle blair was an artist and had a poor opinion of such fry looked indignant and retorted indeed she wasnt,the poor man meant it as a compliment but felicity who knew uncle blair was an artist and had a poor opinion of such fry looked indignant and retorted indeed she wasnt,0.03225806451612903
198-126831-0014,id like to side at two side to side to the city but wed come home tired and with all the milking to do you boys better go alone peter and i will attend the milking for one evening said uncle roger you can all go,id like to sighed felicity but wed come home tired and with all the milking to do you boys better go alone peter and i will attend to the milking for one evening said uncle roger you can all go,0.21739130434782608
198-126831-0015,i have an idea that a raspberry pie for tomorrow night when the folks come home would hit the right spot accordingly after tea we all set off armed with jugs and cups felicity thoughtful creature also took a small basketful of jelly cookies along with her,i have an idea that a raspberry pie for to morrow night when the folks come home would hit the right spot accordingly after tea we all set off armed with jugs and cups felicity thoughtful creature also took a small basketful of jelly cookies along with her,0.0425531914893617
198-126831-0016,a pretty walk through a world of green whispering bows and spiced sweet ferns and shifting patches of sunlight the raspberries were plentiful,a pretty walk through a world of green whispering boughs and spice sweet ferns and shifting patches of sunlight the raspberries were plentiful,0.08695652173913043
