file_name,libristutter_whisper,librispeech_gt,wer_libristutter_whisper
2836-5354-0008,rather than forfeit your fair name and your good conscience for be sure that the alternative if you do rush on to it will be found worse than death on worse than death poor thing poor lady isabel she had sacrificed husband children,rather than forfeit your fair name and your good conscience for be assured that the alternative if you do rush on to it will be found worse than death poor thing poor lady isabel she had sacrificed husband children,0.11627906976744186
2836-5354-0009,reputation home all that makes life of value to woman she had forfeited her duty to god and deliberately broken his commandments for the one poor miserable mistake of flying with francis levison,reputation home all that makes life of value to woman she had forfeited her duty to god had deliberately broken his commandments for the one poor miserable mistake of flying with francis levison,0.030303030303030304
2836-5354-0010,but the instant the step was irrevocable the instant she had left the barrier behind repentance sit in even in the first days of her departure in the fleeting moments of abandonment when it may be supposed she might momentarily forget conscience,but the instant the step was irrevocable the instant she had left the barrier behind repentance set in even in the first days of her departure in the fleeting moments of abandonment when it may be supposed she might momentarily forget conscience,0.023809523809523808
2836-5354-0011,it was sharply wounding her with its outer stings and she knew that her whole future existence whether spent with that man or without him would be a dark course it would be a dark course of knowing retribution nearly a year went by saved some six or eight weeks,it was sharply wounding her with its adder stings and she knew that her whole future existence whether spent with that man or without him would be a dark course of gnawing retribution nearly a year went by save some six or eight weeks,0.18
2836-5354-0012,furnished in the vicinity of the plask grenade a windy for a windy for a windy old house it was full of doors and windows chimneys and cupboards and he said he should remain there lady isabel remonstrated,furnished in the vicinity of the place grenette a windy old house it was full of doors and windows chimneys and cupboards and he said he should remain there lady isabel remonstrated,0.21052631578947367
2836-5354-0013,she wished to go farther on where they might get quicker news from england but her will now was as nothing she was looking like the ghost of her former self talk of her having looked ill when she took the voyage over the water with mr carlisle you should have seen her now,she wished to go farther on where they might get quicker news from england but her will now was as nothing she was looking like the ghost of her former self talk of her having looked ill when she took that voyage over the water with mister carlyle you should have seen her now,0.05555555555555555
2836-5354-0014,missy remarks the countenance worse than sickness her face was white and mid and worn her hands were thin her eyes were sunken and surrounded by by a black circle care was digging caves for them,misery marks the countenance worse than sickness her face was white and worn her hands were thin her eyes were sunken and surrounded by a black circle care was digging caves for them,0.1388888888888889
2836-5354-0015,a stranger might have attributed these signs to the state of her health she knew better knew that they were the effects of her wretched mind and heart it was very late for breakfast but why should she rise early only to drag through another endless day,a stranger might have attributed these signs to the state of her health she knew better knew that they were the effects of her wretched mind and heart it was very late for breakfast but why should she rise early only to drag through another endless day,0.0
2836-5354-0016,languadly she took her seat at the table just as captain levisons servant a frenchman whom he served a frenchman whom he served a frenchman whom he had engaged in paris into the room with two letters point to gazette pierre,languidly she took her seat at the table just as captain levisons servant a frenchman whom he had engaged in paris entered the room with two letters point de gazette pierre,0.3170731707317073
2836-5354-0017,and all the time the slifox had got the times in his coat pocket but he was only obeying the orders of his master his master his master it had been captain levisons recent pleasure that the newspaper should not be seen by lady isabel until he had overlooked them,and all the time the sly fox had got the times in his coat pocket but he was only obeying the orders of his master it had been captain levisons recent pleasure that the newspapers should not be seen by lady isabel until he had over looked them,0.18
2836-5354-0018,you will speedily gather his motive pierre departed through captain levisons room and lady isabel took up the letters and examined their superscription with interest it was known to her that mr carlisle had not lost a moment,you will speedily gather his motive pierre departed toward captain levisons room and lady isabel took up the letters and examined their superscription with interest it was known to her that mister carlyle had not lost a moment,0.07894736842105263
2836-5354-0019,in seeking a divorce and the announcement that it was granted was now daily expected she was anxious for it anxious that kept it in for it anxious that kept it in for it anxious that kept in love and should render her though in her though in her the only reparation in his power before the birth of her unhappy child,in seeking a divorce and the announcement that it was granted was now daily expected she was anxious for it anxious that captain levison should render her the only reparation in his power before the birth of her unhappy child,0.3870967741935484
2836-5354-0020,little thought she that there was not the least intention on his part to make her reparation anymore than he had made it to others who had gone for her she had become painfully aware of the fact that the man for whom she had chosen to sacrifice herself,little thought she that there was not the least intention on his part to make her reparation any more than he had made it to others who had gone before her she had become painfully aware of the fact that the man for whom she had chosen to sacrifice herself,0.061224489795918366
2836-5354-0021,the decked out dandies before the world are frequently the greatest lovins in domestic privacy he wished her good morning in a careless tone of apathy and she as apathetically answered to it pierre says there are some letters he began,the decked out dandies before the world are frequently the greatest slovens in domestic privacy he wished her good morning in a careless tone of apathy and she as apathetically answered to it pierre says there are some letters he began,0.024390243902439025
2836-5354-0022,last out a whole 10 months you are in a greaseless air air air air air compliments the very opposite to honey light opposite to honey and sweetness have generally superveined long before try it if you dont believe me two letters she continued,last out a whole ten months you are in egregious error compliments the very opposite to honey and sweetness have generally supervened long before try it if you dont believe me two letters she continued,0.29545454545454547
2836-5354-0023,and they are both in the same handwriting your solicitors i believe up went his hand at the last word and he made a sort of graph of the letters stuck to the farthest window and the farthest window and the farthest window opened it and glanced over its contents sir,and they are both in the same handwriting your solicitors i believe up went his hand at the last word and he made a sort of grab at the letters stalked to the farthest window opened it and glanced over its contents sir,0.21568627450980393
2836-5354-0024,we beg to inform you that the suit carlisle versus carlisle is at an end the divorce was pronounced without opposition according to your request we hasten to forge you the earliest intimation of the fact we are sir faithfully yours moss and grab,we beg to inform you that the suit carlyle vs carlyle is at an end the divorce was pronounced without opposition according to your request we hasten to forward you the earliest intimation of the fact we are sir faithfully yours moss and grab,0.09090909090909091
2836-5354-0025,it was over then and all claim to the name of carla was declared to have been forfeited by the lady isabelle forever captain levison folded up the letter and placed it securely in an inner pocket is there any news she asks,it was over then and all claim to the name of carlyle was declared to have been forfeited by the lady isabel forever captain levison folded up the letter and placed it securely in an inner pocket is there any news she asked,0.06976744186046512
2836-5354-0026,news of the divorce i mean tush was the response of captain levison as if wishing to imply that the divorce was yet a far off affair,news of the divorce i mean tush was the response of captain levison as if wishing to imply that the divorce was yet a far off affair,0.0
2836-5354-0027,after sending off our last data today we received tidings of the demise of sir peter levison your grand uncle he expired this afternoon in town where he had come for the benefit of medical advice,sir after sending off our last dated to day we received tidings of the demise of sir peter levison your grand uncle he expired this afternoon in town where he had come for the benefit of medical advice,0.1111111111111111
2836-5354-0028,we have much pleasure and congratulate we letting you upon your accession to the title and we and the states and beg to state that should it not be convenient to you to visit england at present we will be happy to transact all necessary matters for you,we have much pleasure in congratulating you upon your accession to the title and estates and beg to state that should it not be convenient to you to visit england at present we will be happy to transact all necessary matters for you,0.16666666666666666
2836-5354-0029,on your favoring us with instructions and we remain sir remain sir remain sir most faithful to yours mauson grab sir francis levison barked the outside of the letter was superscribed as the other f levison s quire,on your favoring us with instructions and we remain sir most faithfully yours moss and grab sir francis levison bart the outside of the letter was superscribed as the other f levison esquire,0.2894736842105263
2836-5354-0030,at last thank the pigs was the gentlemans euphonious expression as he tossed the letter open on the breakfast table the divorce is granted feverishly uttered its granted feverishly uttered lady isabel he may no reply but seated himself to breakfast,at last thank the pigs was the gentlemans euphonious expression as he tossed the letter open on the breakfast table the divorce is granted feverishly uttered lady isabel he made no reply but seated himself to breakfast,0.12195121951219512
2836-5354-0031,you may drop that odious title isabelle which has stuck to me too long i own a better now what one pray oh what one pray oh what one pray you can look and see lady isabelle took up the letter and read it sir francis swallowed down his coffee and rang the head,you may drop that odious title isabel which has stuck to me too long i own a better now what one pray you can look and see lady isabel took up the letter and read it sir francis swallowed down his coffee and rang the,0.2037037037037037
2836-5354-0032,tablehand bell the only bell you generally meet with and take to meet with in france pierre answered it put taytit put me up a change of things that he and french i start for england in an hour it is very well pierre responded and departed to do it,table hand bell the only bell you generally meet with in france pierre answered it put me up a change of things said he in french i start for england in an hour it is very well pierre responded and departed to do it,0.22
2836-5354-0033,lady isabel waited till the man was gone leg on and then spoke a faint flush of emotion in her cheeks you do not mean what you say you will not leave me yet i cannot do otherwise he answered theres a mountain of business to be attended to,lady isabel waited till the man was gone and then spoke a faint flush of emotion in her cheeks you do not mean what you say you will not leave me yet i cannot do otherwise he answered theres a mountain of business to be attended to,0.04081632653061224
2836-5354-0034,besides i should not choose for the old mans funeral to take place without me,besides i should not choose for the old mans funeral to take place without me,0.0
2836-5354-0035,you might not be back in time you might not be back in time in time for what oh how can you ask she rejoined you ask she rejoined in a sharp tone of reproach you know too well and you well and you well and time to make me your wife when the divorce shall appear i shall chance it,you might not be back in time in time for what oh how can you ask she rejoined in a sharp tone of reproach you know too well in time to make me your wife when the divorce shall appear i shall chance it,0.29508196721311475
2836-5354-0036,cooly observes her frances chance it chance the legitimacy of the child you must assure that before all things,coolly observed sir francis chance it chance the legitimacy of the child you must assure that before all things,0.21052631578947367
2836-5354-0037,now dont put yourself in a fever isabel how many times am i to be compelled to beg that of you it does no good is it my fault if i am called suddenly to england have you no pity for your child she urged an agitation,now dont put yourself in a fever isabel how many times am i to be compelled to beg that of you it does no good is it my fault if i am called suddenly to england have you no pity for your child she urged in agitation,0.02127659574468085
2836-5354-0038,nothing can repair the injury if you want suffer it to come upon him he will be a byword amidst men throughout his life you had better have written to the law lords to urge on the divorce he returned i cannot help the delay,nothing can repair the injury if you once suffer it to come upon him he will be a by word amidst men throughout his life you had better have written to the law lords to urge on the divorce he returned i cannot help the delay,0.06666666666666667
2836-5354-0039,there has been no delay quite the contrary but it may be expected hourly now you are worrying yourself for nothing isabelle i shall be back in time he quitted the room as he spoke and lady isabelle remained in it the image of despair,there has been no delay quite the contrary but it may be expected hourly now you are worrying yourself for nothing isabel i shall be back in time he quitted the room as he spoke and lady isabel remained in it the image of despair,0.044444444444444446
2836-5354-0040,nearly an hour elapsed when she remembered the breakfast things and rang for them to be removed,nearly an hour elapsed when she remembered the breakfast things and rang for them to be removed,0.0
2836-5354-0041,where is pierre malady asks,where is pierre miladi asked,0.4
2836-5354-0042,scaresly had she closed the door upon herself and the tretree once her francis levison appeared equipped for traveling goodbye isabelle said he without further circumlocution or ceremony,scarcely had she closed the door upon herself and the tray when sir francis levison appeared equipped for traveling good bye isabel said he without further circumlocution or ceremony,0.25
2836-5354-0043,lady isabel excited beyond all selfcontrol slip the bolt to the door and half leaning against it half leaning at his feet held up her hand in supplication francis have you any consideration left for me any in the world,lady isabel excited beyond all self control slipped the bolt of the door and half leaning against it half leaning at his feet held up her hand in supplication francis have you any consideration left for me any in the world,0.1
2836-5354-0044,how can he be so alarmed isabelle of course i have he continued in a peevishthokind tone as he took hold of her hands to raise her no not yet i will remain here until you say you will wait another day or two,how can you be so alarmed isabel of course i have he continued in a peevish though kind tone as he took hold of her hands to raise her no not yet i will remain here until you say you will wait another day or two,0.11363636363636363
2836-5354-0045,you know that the french protestant minister is prepared to marry us the instant news of the divorce shall arrive,you know that the french protestant minister is prepared to marry us the instant news of the divorce shall arrive,0.0
2836-5354-0046,you will wait you will wait i cannot wait he replied his tone changing to one of determination it is useless you will be useless to urge it he broke from her and left the room and in another minute had left the house pierre attending him a feeling a mounting to a conviction,you will wait i cannot wait he replied his tone changing to one of determination it is useless to urge it he broke from her and left the room and in another minute had left the house pierre attending him a feeling amounting to a conviction,0.16666666666666666
2836-5354-0047,and white and sleedy and sloppy the gutters running through the middle of certain of the streets were unusually black and the people crept along especially dismal close to the fire in the barn of a french bedroom,and white and sleety and sloppy the gutters running through the middle of certain of the streets were unusually black and the people crept along especially dismal close to the fire in the barn of a french bedroom,0.02631578947368421
2836-5354-0048,full of windows and doors and drafts with its wide hearth and its wide chimney into which we could put four or five of our english ones shivered lady isabelle vane she had an invalid cap on and a thick woolen invalid shell,full of windows and doors and draughts with its wide hearth and its wide chimney into which we could put four or five of our english ones shivered lady isabel vane she had an invalid cap on and a thick woolen invalid shawl,0.06976744186046512
2836-5354-0049,and she shook and shivered perpetually though she had drawn so close to the wood fire the wood fire the wood fire that there was a danger of her petticoats igniting and the attendant had frequently to spring up and interpose between them and interpose between them and the crackling logs,and she shook and shivered perpetually though she had drawn so close to the wood fire that there was a danger of her petticoats igniting and the attendant had frequently to spring up and interpose between them and the crackling logs,0.19607843137254902
2836-5354-0050,she had had a long illness terminating in a low fever,she had had a long illness terminating in a low fever,0.0
2836-5354-0051,that a lady would soon get about if she would only rouse herself she had got so far about as to sit up in the windy chamber and it seemed to be to her a matter of perfect indifference whether she ever got out of it,that miladi would soon get about if she would only rouse herself she had got so far about as to sit up in the windy chamber and it seemed to be to her a matter of perfect indifference whether she ever got out of it,0.043478260869565216
2836-5354-0052,had he come who is it had has it has it she asked of the nurse malady it is meshur and pierre is with him i have beg malady often and often not to fret from his show would surely come malady see i am right,had he come who is it she asked of the nurse miladi it is monsieur and pierre is with him i have begged milady often and often not to fret for monsieur would surely come miladi see i am right,0.2826086956521739
2836-5354-0053,the girl departed closing the door and lady isabelle sat looking at it schooling her patients another moment and it was flung open sir francis levison approached to greet her as he came in she waved him off begging him,the girl departed closing the door and lady isabel sat looking at it schooling her patience another moment and it was flung open sir francis levison approached to greet her as he came in she waved him off begging him,0.05
2836-5354-0054,in a subdued quiet tone not to draw too near as any little excitement made her faint now he took a seat opposite to her and began pushing the logs together with his boot as he explained that he really could not get away from town before,in a subdued quiet tone not to draw too near as any little excitement made her faint now he took a seat opposite to her and began pushing the logs together with his boot as he explained that he really could not get away from town before,0.0
2836-5355-0000,settling the logs to his apparent satisfaction to speak and act let there be plain truth between us at this sin of you if there never has been before i dont say sin before i dont say sin before i dont understand you naked truth unglossed over,settling the logs to his apparent satisfaction to speak and act let there be plain truth between us at this interview if there never has been before i dont understand you naked truth unglossed over,0.2765957446808511
2836-5355-0001,she pursued bending her eyes determinedly upon him it must be with all my heart rejoins her francis it is you who have thrown out the challenge mind,she pursued bending her eyes determinately upon him it must be with all my heart returned sir francis it is you who have thrown out the challenge mind,0.10714285714285714
2836-5355-0002,when you left in july you gave me a sacred promise to come back in time for our marriage you know what i mean when i say in time but of course i meant to do so when i gave the promise he interrupted but no sooner had i set my foot in london,when you left in july you gave me a sacred promise to come back in time for our marriage you know what i mean when i say in time but of course i meant to do so when i gave the promise he interrupted but no sooner had i set my foot in london,0.0
2836-5355-0003,then i found myself overwhelmed with business and away from it i could not get even now i can only remain with you a couple of days for i must hasten back to town she said after hearing him calmly to the end,than i found myself overwhelmed with business and away from it i could not get even now i can only remain with you a couple of days for i must hasten back to town you are breaking faith already she said after hearing him calmly to the end,0.13953488372093023
2836-5355-0004,your words are not words of truth but of deceit you did not intend to be back in time for the marriage,your words are not words of truth but of deceit you did not intend to be back in time for the marriage,0.0
2836-5355-0005,what fancies you do take up at her frances levison sometimes subsequent to your departure she quietly went on one of the maids was setting to rights the clothes in your dressing closet and she brought me a letter she found in one of the pockets,what fancies you do take up uttered francis levison some time subsequent to your departure she quietly went on one of the maids was setting to rights the clothes in your dressing closet and she brought me a letter she found in one of the pockets,0.10869565217391304
2836-5355-0006,i saw by the date that it was one of those two which you received on the morning i received on the morning of your departure it contained the information that the divorce was pronounced she spoke so quietly so apparently without feeling or passion that her francis was agreeably astonished,i saw by the date that it was one of those two which you received on the morning of your departure it contained the information that the divorce was pronounced she spoke so quietly so apparently without feeling or passion that sir francis was agreeably astonished,0.11764705882352941
2836-5355-0007,he should have less trouble in throwing off the mask but he was an illtempered man and to hear that the letter had been found to have the falseness of his fine protestations and promises laid bare did not improve his temper now lady isabel continued,he should have less trouble in throwing off the mask but he was an ill tempered man and to hear that the letter had been found to have the falseness of his fine protestations and promises laid bare did not improve his temper now lady isabel continued,0.043478260869565216
2836-5355-0008,it would have been better to have undissieved me then to have told me that the hopes i was cherishing for the sake of the unborn child were worse than vain i did not it did not judge so he replied the excited state you then appeared to be in,it would have been better to have undeceived me then to have told me that the hopes i was cherishing for the sake of the unborn child were worse than vain i did not judge so he replied the excited state you then appeared to be in,0.08
2836-5355-0009,would have precluded your listening to any sort of reason her heart beat a little quicker but she still did you deemed that it was not in reason that i should aspire to be the wife of sir fran would have the wife of sir fran would wife of sir frans is levison he rose and began kicking at the logs with the heel of his boot this time,would have precluded your listening to any sort of reason her heart beat a little quicker but she stilled it you deem that it was not in reason that i should aspire to be the wife of sir francis levison he rose and began kicking at the logs with the heel of his boot this time,0.2463768115942029
