file_name,libristutter_whisper,librispeech_gt,wer_libristutter_whisper
1867-154075-0007,the man grouted some retort and left closing the door heavily behind him while ronniki dune breathed freed freed freed freed again for the first time now said the man of the sneer tell me the whole of it ruth ronniki said his teeth,the man growled some retort and left closing the door heavily behind him while ronicky doone breathed freely again for the first time now said the man of the sneer tell me the whole of it ruth ronicky set his teeth,0.20454545454545456
1867-154075-0008,had the clever devil guessed at the truth so easily had he sent his follower away merely to avoid having it known that a man had taken shelter in the room of the girl he loved go on the leader was repeating let me hear the whole truth,had the clever devil guessed at the truth so easily had he sent his follower away merely to avoid having it known that a man had taken shelter in the room of the girl he loved go on the leader was repeating let me hear the whole truth,0.0
1867-154075-0009,i i i stammered the i stammered the girl and she could say no more the man of the the the sneer left unpleasantly let me help you it was somebody you met somewhere,i i stammered the girl and she could say no more the man of the sneer laughed unpleasantly let me help you it was somebody you met somewhere,0.20588235294117646
1867-154075-0010,you smiled so much in fact that he followed you and found that you had come here the only way he could get in was by stealth is that right,you smiled so much in fact that he followed you and found that you had come here the only way he could get in was by stealth is that right,0.0
1867-154075-0011,so he came in exactly that way like a that way like a robber but really only to keep a trist with his ladylove a pretty story a true romance,so he came in exactly that way like a robber but really only to keep a tryst with his lady love a pretty story a true romance,0.23333333333333334
1867-154075-0012,my dear girl john began ruth tolliver her voice shaking tush you broke in as smoothly as ever let me tell the story for you and spare you your blushes,my dear girl john began ruth tolliver her voice shaking tush he broke in as smoothly as ever let me tell the story for you and spare your blushes,0.06666666666666667
1867-154075-0013,although you were glad to see him you warned him that it was dangerous to play with fire fire being me do i gather the drift to the story fairly well finally you have him worked up to the right pitch,although you were glad to see him you warned him that it was dangerous to play with fire fire being me do i gather the drift of the story fairly well finally you have him worked up to the right pitch,0.024390243902439025
1867-154075-0014,you show him that it is possible,you show him that it is possible,0.0
1867-154075-0015,yes said the girl unevenly that is—ah murmured the man of the sneer you seem rather relieved that i have guessed he left the house in that case raniqi dune had held the latch of the door turn back for some time,yes said the girl unevenly that is ah murmured the man of the sneer you seem rather relieved that i have guessed he left the house in that case ronicky doone had held the latch of the door turned back for some time,0.11904761904761904
1867-154075-0016,now he pushed it open and stepped out he was stepped out he was only barely in time for the man of the sneer was turning quickly in his direction since there was only one hiding place in the room,now he pushed it open and stepped out he was only barely in time for the man of the sneer was turning quickly in his direction since there was only one hiding place in the room,0.1
1867-154075-0017,he was brought up with a shock by the sight of ronikys big cold held at the hip and covering him with absolute certainty ruth tolliver did not cry out but every muscle in her face and body seemed to contract,he was brought up with a shock by the sight of ronickys big colt held at the hip and covering him with absolute certainty ruth tolliver did not cry out but every muscle in her face and body seemed to contract,0.04878048780487805
1867-154075-0018,as if she were preparing herself for the explosion you dont have to put up your hands said ronnicky dune wondering at the familiarity of the face of the man of the sneer he had brooded on it so often in the past few days that it was like the face of an old acquaintance,as if she were preparing herself for the explosion you dont have to put up your hands said ronicky doone wondering at the familiarity of the face of the man of the sneer he had brooded on it so often in the past few days that it was like the face of an old acquaintance,0.03636363636363636
1867-154075-0019,he knew every line in that sharp profile thank you,he knew every line in that sharp profile thank you,0.0
1867-154075-0020,i congratulate you on your good taste a regular apollo my dear ruth he turned turned turned back to ronniki dune and i suppose you have overheard our entire conversation the whole lot of it said ronniki,i congratulate you on your good taste a regular apollo my dear ruth he turned back to ronicky doone and i suppose you have overhead our entire conversation the whole lot of it said ronicky,0.16216216216216217
1867-154075-0021,though i wasnt playing my hand at eves dropping i couldnt help but hear you partner the man of the sneer looked him over leisurely western he said at last decidedly western are you though i the last decidedly western are you staying long in the east my friend,though i wasnt playing my hand at eavesdropping i couldnt help hearing you partner the man of the sneer looked him over leisurely western he said at last decidedly western are you staying long in the east my friend,0.24489795918367346
1867-154075-0022,i dont know said ronnicky dune smiling faintly at the coolness of the other what do you think about it meaning that im liable to put an end to your stay maybe tush tush,i dunno said ronicky doone smiling faintly at the coolness of the other what do you think about it meaning that im liable to put an end to your stay maybe tush tush,0.11764705882352941
1867-154075-0023,i suppose ruth has filled your head with a lot of rot about what a terrible fellow i am but i dont use poison and i dont—i dont—i dont kill with mysterious xrays i am as you see a very quiet and ordinary sort,i suppose ruth has filled your head with a lot of rot about what a terrible fellow i am but i dont use poison and i dont kill with mysterious x rays i am as you see a very quiet and ordinary sort,0.09090909090909091
1867-154075-0024,ronnicky doon doon smile again you just obliged me partner he replied in his own soft voice just stay away from the walls of the room dont even sit down stay and right where you are,ronicky doone smiled again you just oblige me partner he replied in his own soft voice just stay away from the walls of the room dont even sit down stand right where you are,0.19444444444444445
1867-154075-0025,youd murder me if i took another step ask the man of the sneer and a contemptuous and sardonic expression flitted across his face for the first time id sure blow you full of lead said ronnicky fervently,youd murder me if i took another step asked the man of the sneer and a contemptuous and sardonic expression flitted across his face for the first time id sure blow you full of lead said ronicky fervently,0.05263157894736842
1867-154075-0026,id kill you like a snake stranger which i mostly think you are step light and step quick when i talk certainly said the other bowing i am entirely at your service he turned a little to ruth,id kill you like a snake stranger which i mostly think you are so step light and step quick when i talk certainly said the other bowing i am entirely at your service he turned a little to ruth,0.02631578947368421
1867-154075-0027,i see that you have a most determined cavalier i suppose hell instantly abduct you and and sweep you away from beneath my eyes she made a vag gesture of denial go ahead said the leader by the way,i see that you have a most determined cavalier i suppose hell instantly abduct you and sweep you away from beneath my eyes she made a vague gesture of denial go ahead said the leader by the way,0.05128205128205128
1867-154075-0028,my name is john mark im dune some call me ronniki dune im glad to know you ronniki dune i imagine that name fits you now tell me the story of why you came to this house of course it wasnt to see a girl,my name is john mark im doone some call me ronicky doone im glad to know you ronicky doone i imagine that name fits you now tell me the story of why you came to this house of course it wasnt to see a girl,0.1111111111111111
1867-154075-0029,youre wrong it was ah in spite of himself the face of john mark wrinkled with pain and suspicious rage i came to see a girl and her name i figure is carolyn smith,youre wrong it was ah in spite of himself the face of john mark wrinkled with pain and suspicious rage i came to see a girl and her name i figure is caroline smith,0.029411764705882353
1867-154075-0030,relief wonder and even a gleam of outright happiness shot into the eyes of john mark carolyn you came for that suddenly he laughed heartily but there was a trimmer of emotion in that laughter,relief wonder and even a gleam of outright happiness shot into the eyes of john mark caroline you came for that suddenly he laughed heartily but there was a tremor of emotion in that laughter,0.05714285714285714
1867-154075-0031,the perfect torture which had been ringing the soul of the man with the sneer projected through the laughter i asked your pardon my dear said john mark to ruth i should have guessed you found him he confessed why he was here you took pity on him,the perfect torture which had been wringing the soul of the man of the sneer projected through the laughter i ask your pardon my dear said john mark to ruth i should have guessed you found him he confessed why he was here you took pity on him,0.0625
1867-154075-0032,and he brushed a hand across his forehead and was instantly himself calm and cool and cool very well then it seems ive made an ass of myself but ill try to make up for it now what about carolyn,and he brushed a hand across his forehead and was instantly himself calm and cool very well then it seems ive made an ass of myself but ill try to make up for it now what about caroline,0.075
1867-154075-0033,leave this house and take a ride or a walk with me leave me as much as that if you have to talk to her look to her why not do the talking here i dont know replied ronnicky dune i figure shed think too much about you all the time,leave this house and take a ride or a walk with me as much as that if you have to talk to her why not do the talking here i dunno replied ronicky doone i figure shed think too much about you all the time,0.17647058823529413
1867-154075-0034,yes i have a curious stock of useless information well youre right im going to try to get her back to bill but you cant expect me to ascend to that i sure do and why,yes i have a curious stock of useless information well youre right im going to try to get her back for bill but you cant expect me to assent to that i sure do and why,0.05555555555555555
1867-154075-0035,this carolyn smith may be a person of great value to me i have no doubt she is but i got a good argument,this caroline smith may be a person of great value to me i have no doubt she is but i got a good argument,0.041666666666666664
1867-154075-0036,the gun partner and if you couldnt get the girl but she how absurd the whole thing is ronnicky dune i send for the girl i request her to go down with you to the street and take a walk because you wish to talk to her,the gun partner and if you couldnt get the girl but see how absurd the whole thing is ronicky doone i send for the girl i request her to go down with you to the street and take a walk because you wish to talk to her,0.06382978723404255
1867-154075-0037,heavens man i cant persuade her to go with a stranger at night surely you see that ill do the persuading said ronniki doon calmly and when youre on the streets with the girl,heavens man i cant persuade her to go with a stranger at night surely you see that ill do that persuading said ronicky doone calmly and when youre on the streets with the girl,0.08823529411764706
1867-154075-0038,do you suppose ill rest idle and let you walk away with her once were outside of the house mark said ronnicky dune i dont ask no favors let your men come on,do you suppose ill rest idle and let you walk away with her once were outside of the house mark said ronicky doone i dont ask no favors let your men come on,0.06060606060606061
1867-154075-0039,i aint terrible backward with the trigger finger john mark not finger john mark not finger john mark not that i figure on bragging but i want you to pick good men for my trail and tell them to step soft is that square,i aint terrible backward with the trigger finger john mark not that i figure on bragging but i want you to pick good men for my trail and tell em to step soft is that square,0.20454545454545456
1867-154075-0040,suppose we shake hands to bind the bargain said ronnicky you send for carolyn smith im to do the persuading to get her out of the house were safe to the doors of the house the minute we step into the street,suppose we shake hands to bind the bargain said ronicky you send for caroline smith im to do the persuading to get her out of the house were safe to the doors of the house the minute we step into the street,0.047619047619047616
1867-154075-0041,youre free to do anything you want to get either of us will you shake on that for a moment the leader hesitated then his fingers closed over the extended hand of roniky dune and clamp down on them like so many steel wires contracting,youre free to do anything you want to get either of us will you shake on that for a moment the leader hesitated then his fingers closed over the extended hand of ronicky doone and clamped down on them like so many steel wires contracting,0.06666666666666667
1867-154075-0042,at the same time a flush of excitement and fierceness passed over the face of john mark and mark ronnichidun taken utterly by surprise was at a great disadvantage,at the same time a flush of excitement and fierceness passed over the face of john mark ronicky doone taken utterly by surprise was at a great disadvantage,0.10344827586206896
1867-154075-0043,a great rage came into the eyes of john mark a great wonder came into the eyes of the westerner where did john mark get his sudden strength well said ronniki weve shaken hands and now you can do what you please,a great rage came in the eyes of john mark a great wonder came in the eyes of the westerner where did john mark get his sudden strength well said ronicky weve shaken hands and now you can do what you please,0.07142857142857142
1867-154075-0044,sit down leave the room anything,sit down leave the room anything,0.0
1867-154075-0045,that brought us start from john mark and mark and a flash of eagerness but he repressed the idea after a single glance at the girl girl girl weve shaken hands he admitted slowly as though just realizing the full extent of the meaning of that act,that brought a start from john mark and a flash of eagerness but he repressed the idea after a single glance at the girl weve shaken hands he admitted slowly as though just realizing the full extent of the meaning of that act,0.10638297872340426
2007-132570-0000,what were they for they disputing then said emily no moms out not fighting now not fighting but almost as good for i believe there was not one of the senior sober,what were they disputing then said emily no maamselle nor fighting but almost as good for i believe there was not one of the signors sober,0.28125
2007-132570-0001,and what is more not one of those fine ladies sober either and ladies sober either i thought when i saw them first that all those fine silks and fine veils white mums elder veils were worked with silver,and what is more not one of those fine ladies sober either i thought when i saw them first that all those fine silks and fine veils why maamselle their veils were worked with silver,0.1794871794871795
2007-132570-0002,and fine trimmings boated no good i guessed what they were good god esclaimed emily what will become of me,and fine trimmings boded no good i guessed what they were good god exclaimed emily what will become of me,0.1
2007-132570-0003,if you were to go running about the castle among all these drunken seniors,if you are to go running about the castle among all these drunken signors,0.14285714285714285
2007-132570-0004,and across the great hall and up the marble staircase and along the north gallery and through the west wing of the castle and i am in the corridor and a and a and a in a minute are you so says he and what is to become of you if you meet any of those noble cavaliers in the way,and across the great hall and up the marble stair case and along the north gallery and through the west wing of the castle and i am in the corridor in a minute are you so says he and what is to become of you if you meet any of those noble cavaliers in the way,0.13114754098360656
2007-132570-0005,well says i if you think—if you think—if you think there is danger then go with me and guard me i—guard me i—guard me i am never afraid when you are by what says he when i—t— says he when i am scarcely recovered of one wound shall i put myself in the way of getting another,well says i if you think there is danger then go with me and guard me i am never afraid when you are by what says he when i am scarcely recovered of one wound shall i put myself in the way of getting another,0.21052631578947367
2007-132570-0006,no no says he i will cut the way shorter than through the vaulted passage and up the marble marble marble staircase and along the north gallery and through the west wing of the castle for you for you for you shall stay here and at you shall not go out of this room tonight so,no no says he i will cut the way shorter than through the vaulted passage and up the marble stair case and along the north gallery and through the west wing of the castle for you shall stay here annette you shall not go out of this room to night so,0.19642857142857142
2007-132570-0007,well well said emily impatiently and anxious to inquire on another subject,well well said emily impatiently and anxious to enquire on another subject,0.08333333333333333
2007-132570-0008,yes he did indeed mumzell notwithstanding all i could say to the contrary,yes he did indeed maamselle notwithstanding all i could say to the contrary,0.07692307692307693
2007-132570-0009,and he mistook ludovicos hull for old car lows,and he mistook ludovicos hall for old carlos,0.3333333333333333
2007-132570-0010,so we were all as still as night that he might as opposed there was nobody in the room but the senior was as cunning as the best as the best of us and kept calling out at the door,so we were all as still as night that he might suppose there was nobody in the room but the signor was as cunning as the best of us and kept calling out at the door,0.15
2007-132570-0011,come forth my valorous senior steward just then old carlo opened his door and he came with a flask in his hand for as soon as the senior saw him,come forth my valorous signor steward just then old carlo opened his door and he came with a flask in his hand for as soon as the signor saw him,0.06666666666666667
2007-132570-0012,he was as stame as could be and followed him away as naturally as a dog does a butcher with a he he the piece of meat in his basket all this i sought he he he he he through the keyhole well annette said ludovico geringly shall i let you out now,he was as tame as could be and followed him away as naturally as a dog does a butcher with a piece of meat in his basket all this i saw through the key hole well annette said ludovico jeeringly shall i let you out now,0.24528301886792453
2007-132570-0013,interrupted emily quite weird by this story do you know whether there are any prisoners in the castle and whether they are confined at this end of the edifice,interrupted emily quite wearied by this story do you know whether there are any prisoners in the castle and whether they are confined at this end of the edifice,0.034482758620689655
2007-132570-0014,but it is expected back tonight or tomorrow and i shall know then perhaps emily inquired if she had ever heard the servants talk of prisoners ah mums cell said a net archery,but it is expected back to night or to morrow and i shall know then perhaps emily enquired if she had ever heard the servants talk of prisoners ah maamselle said annette archly,0.30303030303030304
2007-132570-0015,now i dare say you are thinking of montsuerval in court and that he may have come among the armies which they say are come from our country to fight against this state and that he has met with some of our people and is taking captive,now i dare say you are thinking of monsieur valancourt and that he may have come among the armies which they say are come from our country to fight against this state and that he has met with some of our people and is taken captive,0.0851063829787234
2007-132570-0016,oh lord how glad i should be if it was so would you indeed be glad said emily in a tone of mournful reproach to be sure i should,o lord how glad i should be if it was so would you indeed be glad said emily in a tone of mournful reproach to be sure i should,0.034482758620689655
2007-132570-0017,goodman replied a net and would not you be glad too to see senior valencourt i dont know any chevrolet or i like better mad mad like better like better i have a very great regard for the senior truly,maam replied annette and would not you be glad too to see signor valancourt i dont know any chevalier i like better i have a very great regard for the signor truly,0.35
2007-132570-0018,you regard for him cannot be doubted sent emily since you wish to see him a prisoner why no mumzel not a prisoner either but one must be glad to see him you know and it was only the other night i dreamt,your regard for him cannot be doubted said emily since you wish to see him a prisoner why no maamselle not a prisoner either but one must be glad to see him you know and it was only the other night i dreamt,0.06976744186046512
2007-132570-0019,and then it was gone and nothing to be seen but the old castle walls so they helped one another up again as fast as they could you would not believe mumzel the way i showed you the very cannon where it used to appear,and then it was gone and nothing to be seen but the old castle walls so they helped one another up again as fast as they could you would not believe maamselle though i shewed you the very cannon where it used to appear,0.08888888888888889
2007-132570-0020,and are you indeed so simple indeed so simple indeed so simple annette said emily smiling at this curious exaggeration of the circumstances she had witnessed as to credit these stories credit these stories credit these stories credit them mumsell why,and are you indeed so simple annette said emily smiling at this curious exaggeration of the circumstances she had witnessed as to credit these stories credit them maamselle why,0.3170731707317073
2007-132570-0021,all the world could not persuade me out of them roberto and sebastian in half a dozen more of them went into fits to be sure there was no occasion for that i said myself there was no need of that,all the world could not persuade me out of them roberto and sebastian and half a dozen more of them went into fits to be sure there was no occasion for that i said myself there was no need of that,0.024390243902439025
2007-132570-0022,for as i when the enemy comes what a pretty figure they will cut if they are to fall down and fit all of a row the enemy wont be so civil perhaps as to walk off like the ghost and leave them to help one another up,for says i when the enemy comes what a pretty figure they will cut if they are to fall down in fits all of a row the enemy wont be so civil perhaps as to walk off like the ghost and leave them to help one another up,0.0625
2007-132570-0023,but will fall too cutting and slashing but too cutting and slashing till he makes them all rise up dead men no no says i there is rererereason in all things,but will fall to cutting and slashing till he makes them all rise up dead men no no says i there is reason in all things,0.22580645161290322
2007-132570-0024,being because it is because it is no business of mine to look rough and fight battles emily endeavored to correct the superstitious weakness of a net though she could not entirely subdue her own to which the latter only replied,being because it is no business of mine to look gruff and fight battles emily endeavoured to correct the superstitious weakness of annette though she could not entirely subdue her own to which the latter only replied,0.17073170731707318
2007-132570-0025,nay memzel you will believe nothing you are almost as bad as the senior himself who was in a great passion when they told of what had happened and swore that the first man who repeated such nonsense should be thrown into the dungeon under the east turret this was a hard pun,nay maamselle you will believe nothing you are almost as bad as the signor himself who was in a great passion when they told of what had happened and swore that the first man who repeated such nonsense should be thrown into the dungeon under the east turret this was a hard,0.05660377358490566
