file_name,libristutter_whisper,librispeech_gt,wer_libristutter_whisper
5561-39621-0038,all these trumpets are his all those gilded housings are his all those gentlemen wear swords that are his his mother proceeds him in a carriage magnificently encrossed with silver and gold happy mother,all these trumpets are his all those gilded housings are his all those gentlemen wear swords that are his his mother precedes him in a carriage magnificently encrusted with silver and gold happy mother,0.058823529411764705
5561-39621-0039,and conducts him to a rich bride then all these people rejoice they love their king,and conducts him to a rich bride then all these people rejoice they love their king,0.0
5561-39621-0040,well well my lord said perry more uneasy at the turn of the conversation had taken than at the other you never assume the unknown that my mother and my sister will all this is going on in honor of the king of france have neither money nor bread you know that i my soul shall be poor and degraded within a fortnight,well well my lord said parry more uneasy at the turn the conversation had taken than at the other you know resumed the unknown that my mother and my sister whilst all this is going on in honor of the king of france have neither money nor bread you know that i myself shall be poor and degraded within a fortnight,0.1111111111111111
5561-39621-0041,perry are there not examples in which a man of my condition should himself my lord in the name of heaven,parry are there not examples in which a man of my condition should himself my lord in the name of heaven,0.047619047619047616
5561-39621-0042,no no i have two arms perry and i have a sword and he struck his arm violently with his hand and took down his sword which hung against the wall,no no i have two arms parry and i have a sword and he struck his arm violently with his hand and took down his sword which hung against the wall,0.03225806451612903
5561-39621-0043,what am i going to do perry what everyone in my family does my mother lives in public charity my sister begs for my mother i have somewhere or other brothers who equally beg for themselves and i the eldest will go and do as all the rest do i will go and ask charity,what am i going to do parry what every one in my family does my mother lives on public charity my sister begs for my mother i have somewhere or other brothers who equally beg for themselves and i the eldest will go and do as all the rest do i will go and ask charity,0.07272727272727272
5561-39621-0044,and with these words which he finished sharply with a nervous and terrible laugh the young man girded it on his sword took his hat from the trunk,and with these words which he finished sharply with a nervous and terrible laugh the young man girded on his sword took his hat from the trunk,0.03571428571428571
5561-39621-0045,my good perry said he order a fire drink eat sleep and be happy let us both be happy my faithful friend my only friend we are rich as riches kings,my good parry said he order a fire drink eat sleep and be happy let us both be happy my faithful friend my only friend we are rich as rich as kings,0.0967741935483871
5561-41615-0000,chapter 15 a woodbeard lark,chapter fifteen a would be lark,0.6
5561-41615-0001,the majority however appeared to be highly delighted over what they delighted over what they heard one group standing near one of the windows of which eleanor was the center laughed so loudly that they were sent to their seats,the majority however appeared to be highly delighted over what they heard one group standing near one of the windows of which eleanor was the center laughed so loudly that they were sent to their seats,0.1
5561-41615-0002,and as the morning advance they became fully aware that something unusual was in the wind so at all times they caught sight of a folded paper being stealthily passed from one desk to another but as to its contents they had no idea as it was not handed to any one of them,and as the morning advanced they became fully aware that something unusual was in the wind several times they caught sight of a folded paper being stealthily passed from one desk to another but as to its contents they had no idea as it was not handed to any one of them,0.07407407407407407
5561-41615-0003,at recess there was more grouping and whispering and grace was puzzled and not a little hurt over the way in which she and her friends were ignored such a thing had not happened since the basketball trouble the previous year,at recess there was more grouping and whispering and grace was puzzled and not a little hurt over the way in which she and her friends were ignored such a thing had not happened since the basketball trouble the previous year,0.0
5561-41615-0004,eleanor started that paper started that paper whatever it is said nora omalley of the pysigmatown who stood in a group around her desk she was here when i came in this morning and i was early too,eleanor started that paper whatever it is said nora omalley to the phi sigma tau who stood in a group around her desk she was here when i came in this morning and i was early too it,0.21052631578947367
5561-41615-0005,here comes mabels suggestica maybe she has seen the paper,here comes mabel said jessica maybe she has seen the paper,0.3
5561-41615-0006,mabel nodded what was written on it mabel ask grace curiously mabel asked grace curiously mabel looked distressed for a moment then she said,mabel nodded what was written on it mabel asked grace curiously mabel looked distressed for a moment then she said,0.16666666666666666
5561-41615-0007,but i gave my word of honor before i read it that i wouldnt mention the contents to anyone then of course we wont but of course we wont ask you sid and pearson quickly but tell us this much is it about any of us no replied mabel it isnt it is something i was asked to sign,but i gave my word of honor before i read it that i wouldnt mention the contents to any one then of course we wont ask you said anne pierson quickly but tell us this much is it about any of us no replied mabel it isnt it is something i was asked to sign,0.1694915254237288
5561-41615-0008,and did you sign it as jessica i certainly did not respond to maple it was she stopped and flushed,and did you sign it asked jessica i certainly did not responded mabel it was she stopped then flushed,0.25
5561-41615-0009,i cant bear to have secrets and not tell you,i cant bear to have secrets and not tell you,0.0
5561-41615-0010,we dont want you to tell if it doesnt concern us we dont care do we dont care do we girls no indeed was the reply just then the bell sounded and the girls returned to their seats with the riddle still unsolved,we dont want you to tell if it doesnt concern us we dont care do we girls no indeed was the reply just then the bell sounded and the girls returned to their seats with the riddle still unsolved,0.09302325581395349
5561-41615-0011,on wednesday aside from a little more whispering and significant glances exchanged among the pupils not a ripple disturbed the calm of the study hall it was therefore a distinct and not altogether pleasant surprise when miss thompson walked into the room,on wednesday aside from a little more whispering and significant glances exchanged among the pupils not a ripple disturbed the calm of the study hall it was therefore a distinct and not altogether pleasant surprise when miss thompson walked into the room,0.0
5561-41615-0012,dismissed the senior senior class and requested the three level classes to remain in their seats after the seats after the business seats after the seniors had quietly left the study hall ms thompson stood gravely regarding the rows of girls before her her eyes wandered toward where ellen or sat looking bored and indifferent,dismissed the senior class and requested the three lower classes to remain in their seats after the seniors had quietly left the study hall miss thompson stood gravely regarding the rows of girls before her her eyes wandered toward where eleanor sat looking bored and indifferent,0.21818181818181817
5561-41615-0013,and then she looked towards grace who looked towards grace who looked towards grace who steady gray eyes were fixed on the principals face with respectful attention i dont believe grace is guilty at any rate thought ms thompson then she addressed the assembled girls something has come to my ears girls so the principal,and then she looked toward grace whose steady gray eyes were fixed on the principals face with respectful attention i dont believe grace is guilty at any rate thought miss thompson then she addressed the assembled girls something has come to my ears girls said the principal,0.21818181818181817
5561-41615-0014,that i find hard to credit but before you leave here this afternoon i must know who is innocent and who is guilty ms thompson paused and a number of girls stirred uneasily in their seats while a few glanced quickly toward eleanor who was looking straight ahead the picture of innocence,that i find hard to credit but before you leave here this afternoon i must know who is innocent and who is guilty miss thompson paused and a number of girls stirred uneasily in their seats while a few glanced quickly toward eleanor who was looking straight ahead the picture of innocence,0.019230769230769232
5561-41615-0015,that it is strictly forbidden for any pupil to absent herself from school for the purpose of attending a circus matinee or any public performance of this nature i have so severely disciplined pupils for this offense that for a long time no one has disobeyed me,that it is strictly forbidden for any pupil to absent herself from school for the purpose of attending a circus matinee or any public performance of this nature i have so severely disciplined pupils for this offence that for a long time no one has disobeyed me,0.02127659574468085
5561-41615-0016,i was therefore astonished to learn that a number of girls regardless of the rules have taken matters into their own hands and have decided to absent themselves from school tomorrow in order to attend the matinee to be given in the theater,i was therefore astonished to learn that a number of girls regardless of rules have taken matters into their own hands and have decided to absent themselves from school to morrow in order to attend the matinee to be given in the theatre,0.09302325581395349
5561-41615-0017,such a decision is worse than disobedience it is lawlessness,such a decision is worse than disobedience it is lawlessness,0.0
5561-41615-0018,the standard of the school will be lowered therefore i intend to sift this matter to the bottom and find out what mischievous influence prompted this act of insubordination report says that this movement originated in the junior class,the standard of the school will be lowered therefore i intend to sift this matter to the bottom and find out what mischievous influence prompted this act of insubordination report says that this movement originated in the junior class,0.0
5561-41615-0019,and that a paper has been circulated and signed by certain pupils who pledge themselves to play truant in attend the matinee tomorrow the eyes of grace and her chums turned questionally toward mabel allison who nodded slightly in the affirmative so that was what all the whispering and mystery had meant,and that a paper has been circulated and signed by certain pupils who pledged themselves to play truant and attend the matinee to morrow the eyes of grace and her chums turned questioningly toward mabel allison who nodded slightly in the affirmative so that was what all the whispering and mystery had meant,0.09615384615384616
5561-41615-0020,grace and really congratulated herself on having kept clear of the whole thing none of her friends were implicated either even mabel had refused to sign,grace inwardly congratulated herself on having kept clear of the whole thing none of her friends were implicated either even mabel had refused to sign,0.07692307692307693
5561-41615-0021,what i assist upon knowing now well now is who are the real culprits beginning with the girl who originated the paper to the last one who signed it,what i insist upon knowing now is who are the real culprits beginning with the girl who originated the paper to the last one who signed it,0.10344827586206896
5561-41615-0022,her example was followed until twothirds of the girls present were standing the principal stood silently regarding them with an expression of severity that was decidedly disconfidding that will do she said currently,her example was followed until two thirds of the girls present were standing the principal stood silently regarding them with an expression of severity that was decidedly discomfitting that will do she said curtly,0.12121212121212122
5561-41615-0023,after they had stood for what seemed to them in age but was really only a couple of minutes you may be seated the girl who composed and after the girl who composed and wrote that agreement will now rise and explain herself without hesitating eleanor rose in regard to the principle with an insolent smile,after they had stood for what seemed to them an age but was really only a couple of minutes you may be seated the girl who composed and wrote that agreement will now rise and explain herself without hesitating eleanor rose and regarded the principal with an insolent smile,0.19642857142857142
5561-41615-0024,i wrote it miss thompson she said clearly i wrote it because i wished to,i wrote it miss thompson she said clearly i wrote it because i wished to,0.0
5561-41615-0025,because it has spoiled all our fun there was a gasp of horror at eleanors assertion no one had ever before spoken so disrespectively to the revered principal miss seval said the principal quietly although her flashing eyes and set lips show that she was very angry,because it has spoiled all our fun there was a gasp of horror at eleanors assertion no one had ever before spoken so disrespectfully to their revered principal miss savell said the principal quietly although her flashing eyes and set lips showed that she was very angry,0.0851063829787234
5561-41615-0026,if you have that paper in your possession bring it to me at once and never answer me again as you did just now you are both disrespectful disrespectful and impertinent but miss thompsons anger toward eleanor was nothing compared with the tempest that the principal had aroused in eleanor,if you have that paper in your possession bring it to me at once and never answer me again as you did just now you are both disrespectful and impertinent but miss thompsons anger toward eleanor was nothing compared with the tempest that the principal had aroused in eleanor,0.02
5561-41615-0027,the latter flushed then turned perfectly white with rage still standing she reached down,the latter flushed then turned perfectly white with rage still standing she reached down,0.0
5561-41615-0028,words cannot express my contempt for them and right here i accused grace harlow and her sorority of getting the information from mabel allison yesterday and carrying it to you they are all tail bearers and sneaks,words cannot express my contempt for them and right here i accuse grace harlowe and her sorority of getting the information from mabel allison yesterday and carrying it to you they are all tale bearers and sneaks,0.08108108108108109
5561-41615-0029,with these words ellen or angerly flung the book she held on the desk we held on the desk and walked down the aisle towards the door but ms thompson barred her way stop ms seville she commanded,with these words eleanor angrily flung the book she held on the desk and walked down the aisle toward the door but miss thompson barred her way stop miss savell she commanded,0.3157894736842105
5561-41615-0030,i will not tolerate such behavior eleanor gleirard at the principal whose face was rigid in its purpose then sank into the nearest vacant seat saying defiantly you may keep me here all night if you like,i will not tolerate such behavior eleanor glared at the principal whose face was rigid in its purpose then sank into the nearest vacant seat saying defiantly you may keep me here all night if you like,0.02702702702702703
5561-41615-0031,nevertheless she did not again attempt to leave the room she room she had met with the will stronger than her own and she realized it ignoring eleanors final remark miss thompson once more turned her attention to the matter in hand,nevertheless she did not again attempt to leave the room she had met with a will stronger than her own and she realized it ignoring eleanors final remark miss thompson once more turned her attention to the matter in hand,0.07142857142857142
5561-41615-0032,those girls who were not in any way implicated in this matter are just smishy said about onethird of the girls arose and prepared to leave the study hall the pie sigma tau being among the number,those girls who are not in any way implicated in this matter are dismissed she said about one third of the girls arose and prepared to leave the study hall the phi sigma tau being among the number,0.16216216216216217
5561-41615-0033,grace motioned the girls to hurry she wished to leave the room with her friends before ms thompson noticed them she knew the principal would insist on an apology from eleanor and either she nor her friends wished it for the first time since eleanor had chosen to cut their acquaintance,grace motioned the girls to hurry she wished to leave the room with her friends before miss thompson noticed them she knew the principal would insist on an apology from eleanor and neither she nor her friends wished it for the first time since eleanor had chosen to cut their acquaintance,0.0392156862745098
5561-41615-0034,grace was thoroughly angry with her she could not forgive eleanor for having accused her and her friends of caring tales before almost the entire school therefore a forced apology would not have peace her wounded pride,grace was thoroughly angry with her she could not forgive eleanor for having accused her and her friends of carrying tales before almost the entire school therefore a forced apology would not appease her wounded pride,0.08108108108108109
5561-41615-0035,she drew a breath of relief when the eight girls were safely outside the study hall door hurry up she said well talk when we get outside school dont stop for a minute if miss thompson notices that were gone shell send after us,she drew a breath of relief when the eight girls were safely outside the study hall door hurry up she said well talk when we get outside school dont stop for a minute if miss thompson notices that we are gone shell send after us,0.045454545454545456
5561-41615-0036,the girls suddenly donned their raps and fled from the building like fugitives from justice once on the street a lively confab and sood all talking at once lets once lets once lets take turns talking craig grays laughing we shall understand each other a little better,the girls silently donned their wraps and fled from the building like fugitives from justice once on the street a lively confab ensued all talking at once lets take turns talking cried grace laughing we shall understand each other a little better,0.2127659574468085
5561-41615-0037,she has certainly shown her true colors this time i never heard of anything more unjust than the way she accused us when we knew nothing about her old plans at miriam barber it was a bominable bominable said eva allen the other girls expressed their disapproval in equally frank terms,she has certainly shown her true colors this time i never heard of anything more unjust than the way she accused us when we knew nothing about her old plan said marian barber it was abominable said eva allen the other girls expressed their disapproval in equally frank terms,0.11764705882352941
5561-41615-0038,i suppose it did look as though i told you girls said maybe allison who would join them at the gate you know i was with you at recess right after the paper had been passed to me,i suppose it did look as though i told you girls said mabel allison who had joined them at the gate you know i was with you at recess right after the paper had been passed to me,0.07894736842105263
5561-41615-0039,it was passed to me by mistake very likely i agree grace i wonder who did tell ms thompson i saw several goals with the paper,it was passed to me by mistake very likely agreed grace i wonder who did tell miss thompson i saw several girls with the paper,0.15384615384615385
5561-41615-0040,they will be weeping and whaling in the skull and crossbones crowd exclaim norah they are all in this mix up and if they arent suspended theyll be lucky,there will be weeping and wailing in the skull and crossbones crowd exclaimed nora they are all in this mix up and if they arent suspended theyll be lucky,0.13793103448275862
5561-41615-0041,no say grace grace shortly she deserves to be punished the thing she said to ms thompson were disgraceful and i shall never forgive her for the way she spoke of us i wouldnt say that grace remarked anne you can never tell what may happen to change your views,no said grace shortly she deserves to be punished the things she said to miss thompson were disgraceful and i shall never forgive her for the way she spoke of us i wouldnt say that grace remarked anne you can never tell what may happen to change your views,0.08
5561-41615-0042,it will have to be something remarkable in this instance for applied grace scrimmly as she bade the girls goodbye remember girls basketball practice again tomorrow and the rest of the week ms thompson has promised me the gymnasium please make it a point to be on hand,it will have to be something remarkable in this instance replied grace grimly as she bade the girls good bye remember girls basketball practice again to morrow and the rest of the week miss thompson has promised me the gymnasium please make it a point to be on hand,0.16666666666666666
5561-41615-0043,gabai grace coerced her friends and went on down the street discussing the probable fate of the fate of the great of the woodbeat fruits to return to those youthful transgressors they were spending a most uncomfortable half hour with miss thompson she was merciless in her denunciation of their conduct,good bye grace chorused her friends and went on down the street discussing the probable fate of the would be truants to return to those youthful transgressors they were spending a most uncomfortable half hour with miss thompson she was merciless in her denunciation of their conduct,0.21568627450980393
5561-41615-0044,and the tear of suspension arose in more than one mind as they listened to her scathing remarks,and the terror of suspension arose in more than one mind as they listened to her scathing remarks,0.05555555555555555
5561-41615-0045,but there was nothing funny about it now when with the exception of eleanor the principal dismissed them they followed decoriously out very uneasy in mind ms thompson had taken their names but had not stated their punishment and it was certain that they would be made to feel the full weight of her displeasure,but there was nothing funny about it now when with the exception of eleanor the principal dismissed them they filed decorously out very uneasy in mind miss thompson had taken their names but had not stated their punishment and it was certain that they would be made to feel the full weight of her displeasure,0.05454545454545454
5561-41615-0046,when the last girl had disappeared the principal turned to eleanor,when the last girl had disappeared the principal turned to eleanor,0.0
5561-41615-0047,do you intend to obey me miss seval ask miss thompson still there was no answer very well continue miss thompson your silence indicates that you are still in subordinate you may therefore choose between two things,do you intend to obey me miss savell asked miss thompson still there was no answer very well continued miss thompson your silence indicates that you are still insubordinate you may therefore choose between two things,0.13513513513513514
5561-41615-0048,you may apologize to me now and tomorrow to the girls you have accused of treachery,you may apologize to me now and to morrow to the girls you have accused of treachery,0.125
5561-41616-0000,16 the juniors forever when the four classes assembled thursday morning every girl with the exception of eleanor was in her seat,chapter sixteen the juniors forever when the four classes assembled thursday morning every girl with the exception of eleanor was in her seat,0.09090909090909091
5561-41616-0001,after conducting conducting conducting opening exercises ms thompson pronounced sentence on the culprits they were to forfeit their recess library and all other privileges until the end of the term,after conducting opening exercises miss thompson pronounced sentence on the culprits they were to forfeit their recess library and all other privileges until the end of the term,0.1
5561-41616-0002,they must turn in two themes every week of not less than 600 words not less than 600 words uncertain subjects to be assigned to them if during this time any one of them should be reported for a misdemeanor they were to be suspended without delay,they must turn in two themes every week of not less than six hundred words on certain subjects to be assigned to them if during this time any one of them should be reported for a misdemeanor they were to be suspended without delay,0.1702127659574468
